{"schema_version":2,"level_id":"task_0023zx_key_lock","title":"Key lock","terrain_rows":["#######","#.....#","#.....#","#######"],"player_spawn":[1,1],"echoes":[{"id":"echo_a","delay":1,"spawn":[1,2]}],"plates":[],"doors":[],"exit":{"position":[5,1]},"metadata":{"teaching_goal":"key","intended_mechanics":["key"],"notes":"","allow_zero_echo_tutorial":false},"validation":{"recommended_search_depth":16},"crates":[],"keys":[{"id":"key_a","position":[2,1],"key_type":"main"}],"locks":[{"id":"lock_a","position":[3,1],"key_type":"main"}],"barrier_groups":[],"sensors":[],"latches":[]}
