{"schema_version":2,"level_id":"task_0023zx_sensor_barrier","title":"Sensor barrier","terrain_rows":["#######","#.....#","#.....#","#######"],"player_spawn":[1,1],"echoes":[{"id":"echo_a","delay":1,"spawn":[1,2]}],"plates":[],"doors":[],"exit":{"position":[5,1]},"metadata":{"teaching_goal":"sensor","intended_mechanics":["sensor"],"notes":"","allow_zero_echo_tutorial":false},"validation":{"recommended_search_depth":16},"crates":[],"keys":[],"locks":[],"barrier_groups":[{"id":"barrier_a","cells":[[3,1],[3,2]],"initial_open":false,"all_sensor_ids":["sensor_a"]}],"sensors":[{"id":"sensor_a","position":[2,1],"activator":"YOU_ONLY","include_crates":false}],"latches":[]}
