{"schema_version":2,"level_id":"task_0023zx_integration","title":"Integration","terrain_rows":["#######","#.....#","#.....#","#######"],"player_spawn":[1,1],"echoes":[{"id":"echo_a","delay":1,"spawn":[1,2]}],"plates":[],"doors":[],"exit":{"position":[5,1]},"metadata":{"teaching_goal":"integration","intended_mechanics":["crate","key","sensor"],"notes":"","allow_zero_echo_tutorial":false},"validation":{"recommended_search_depth":24},"crates":[{"id":"crate_a","position":[2,2]}],"keys":[{"id":"key_a","position":[2,1],"key_type":"main"}],"locks":[{"id":"lock_a","position":[3,1],"key_type":"main"}],"barrier_groups":[{"id":"barrier_a","cells":[[4,1]],"initial_open":false,"all_sensor_ids":["sensor_a"]}],"sensors":[{"id":"sensor_a","position":[3,2],"activator":"ANY_ACTOR","include_crates":true}],"latches":[]}
