{"schema_version":2,"level_id":"task_0023zx_crate_echo","title":"Crate echo","terrain_rows":["#######","#.....#","#.....#","#######"],"player_spawn":[1,1],"echoes":[{"id":"echo_a","delay":1,"spawn":[1,2]}],"plates":[],"doors":[],"exit":{"position":[5,1]},"metadata":{"teaching_goal":"crate","intended_mechanics":["crate"],"notes":"","allow_zero_echo_tutorial":false},"validation":{"recommended_search_depth":16},"crates":[{"id":"crate_a","position":[2,1]}],"keys":[],"locks":[],"barrier_groups":[],"sensors":[],"latches":[]}
